{
  "$schema": "https://json-schema.org/draft/2020-12/schema",
  "$id": "https://example.invalid/everything-exam-preparation/example_review_ledger.schema.json",
  "title": "ExampleReviewLedger",
  "type": "object",
  "additionalProperties": false,
  "required": [
    "object_type",
    "ledger_id",
    "target_group_key",
    "records",
    "non_transferable_content",
    "promotion_summary",
    "qa_status"
  ],
  "properties": {
    "object_type": { "const": "ExampleReviewLedger" },
    "ledger_id": { "type": "string", "minLength": 1 },
    "target_group_key": { "type": "string", "minLength": 1 },
    "records": {
      "type": "array",
      "minItems": 1,
      "items": {
        "type": "object",
        "additionalProperties": false,
        "required": [
          "example_id",
          "source_role",
          "example_scope",
          "what_worked",
          "why_it_worked",
          "what_failed",
          "why_it_failed",
          "transferable_principle",
          "non_transferable_content",
          "anti_overfit_rule",
          "affected_protocols",
          "affected_scripts",
          "validation_check",
          "regression_fixture",
          "promotion_status",
          "confidence"
        ],
        "properties": {
          "example_id": { "type": "string", "minLength": 1 },
          "source_role": {
            "type": "string",
            "enum": ["style_exemplar", "feedback", "cross_target_example", "benchmark_fixture", "other_example"]
          },
          "example_scope": { "type": "string", "minLength": 1 },
          "what_worked": { "type": "array", "items": { "type": "string", "minLength": 1 }, "minItems": 1 },
          "why_it_worked": { "type": "array", "items": { "type": "string", "minLength": 1 }, "minItems": 1 },
          "what_failed": { "type": "array", "items": { "type": "string", "minLength": 1 }, "minItems": 1 },
          "why_it_failed": { "type": "array", "items": { "type": "string", "minLength": 1 }, "minItems": 1 },
          "transferable_principle": { "type": "string", "minLength": 1 },
          "non_transferable_content": { "type": "array", "items": { "type": "string", "minLength": 1 }, "minItems": 1 },
          "anti_overfit_rule": { "type": "string", "minLength": 1 },
          "affected_protocols": { "type": "array", "items": { "type": "string", "minLength": 1 } },
          "affected_scripts": { "type": "array", "items": { "type": "string", "minLength": 1 } },
          "validation_check": { "type": "string", "minLength": 1 },
          "regression_fixture": { "type": "string", "minLength": 1 },
          "promotion_status": { "type": "string", "enum": ["candidate", "accepted", "rejected", "blocked"] },
          "confidence": { "type": "string", "enum": ["high", "medium", "low"] }
        }
      }
    },
    "non_transferable_content": { "type": "array", "items": { "type": "string", "minLength": 1 } },
    "promotion_summary": {
      "type": "object",
      "additionalProperties": false,
      "required": ["accepted_count", "candidate_count", "rejected_count", "blocked_count"],
      "properties": {
        "accepted_count": { "type": "integer", "minimum": 0 },
        "candidate_count": { "type": "integer", "minimum": 0 },
        "rejected_count": { "type": "integer", "minimum": 0 },
        "blocked_count": { "type": "integer", "minimum": 0 }
      }
    },
    "qa_status": { "type": "string", "enum": ["pass", "warning", "fail"] }
  }
}
