{
  "object_type": "ExampleReviewLedger",
  "ledger_id": "ledger_fixture_valid",
  "target_group_key": "generic_example_learning_fixture",
  "records": [
    {
      "example_id": "example_style_density_001",
      "source_role": "cross_target_example",
      "example_scope": "A non-target output used to inspect density and source-coverage behaviour.",
      "what_worked": [
        "Definitions and contrast pairs were split into standalone visible modules.",
        "Criteria lists were preserved as lists rather than compressed into prose."
      ],
      "why_it_worked": [
        "The source features had different exam functions and needed separate recall actions.",
        "List structure preserved answerable components."
      ],
      "what_failed": [
        "no failure observed"
      ],
      "why_it_failed": [
        "not applicable because no failure was observed"
      ],
      "transferable_principle": "When source features have distinct answer functions, protect them as separate visible modules before applying exam overlay.",
      "non_transferable_content": [
        "ExampleTopicAlpha",
        "ExampleCourseAlpha",
        "example_style_density_001"
      ],
      "anti_overfit_rule": "Do not copy the example topic sequence; apply the rule only when the target source contains the same source-feature pattern.",
      "affected_protocols": [
        "references/example_analysis_protocol.md",
        "references/exam_prep_notes_protocol.md"
      ],
      "affected_scripts": [
        "scripts/example_transfer_linter.py",
        "scripts/exam_prep_notes_linter.py"
      ],
      "validation_check": "example transfer lint passes and protected-item lint verifies generic source-feature coverage.",
      "regression_fixture": "tests/fixtures/example_learning/valid_example_review_ledger.json",
      "promotion_status": "accepted",
      "confidence": "high"
    }
  ],
  "non_transferable_content": [
    "ExampleTopicAlpha",
    "ExampleCourseAlpha",
    "example_style_density_001"
  ],
  "promotion_summary": {
    "accepted_count": 1,
    "candidate_count": 0,
    "rejected_count": 0,
    "blocked_count": 0
  },
  "qa_status": "pass"
}
